{
  "contract": "ralph.spawn_request",
  "contract_version": 1,
  "issue": 1743,
  "lane": "w",
  "slug": "claim-v2-multi-holder",
  "harness": "claude",
  "branch": "feat/1743-claim-v2-multi-holder",
  "base": "main",
  "parent_ref": "o1700-herdr-v2-rollout#a3f2",
  "depth": 1,
  "invoked_by": "agent"
}
